{
  "schema_version": "wake.case_summary.v1",
  "summary_id": "evidence-ablation-v1-context-environment",
  "case_id": "ablation-case-002-wind-shift-plan-deviation-context-environment",
  "generated_by": "scripts/build_evidence_ablation.py@1.0",
  "input_hashes": {
    "context.json": "e6d9320261ced80b14bffbf6812c9d48c74ef4930d686df56a406ede30da3b48",
    "environment.json": "b494d72843465766f2959822db2d3112cfb560ee70b038bfdc4168780fadd9ad",
    "plan.json": "ae7276eafdd99a8f36592f599a9c53801e13cba91adc28cc71e6145ea1d4572a",
    "speedcoach.csv": "c48af984c4bac0a8dbdcc5d66b6932d998514ce90cc297ebf63ed195b48813e3"
  },
  "investigation_request": "Compare the planned and performed session, explain supported speed changes, identify real deviations, and state what remains unknown.",
  "domain_knowledge": [
    {
      "term": "voga",
      "meaning": "Target stroke rate in strokes per minute (SPM).",
      "status": "HUMAN_CONFIRMED",
      "limitations": []
    },
    {
      "term": "B0-B7 and E1-E7",
      "meaning": "Standardized rowing training-zone codes.",
      "status": "HUMAN_CONFIRMED",
      "limitations": [
        "Exact effort, physiological, heart-rate, lactate, and power boundaries are not supplied."
      ]
    }
  ],
  "known_context": {
    "session_candidate": {
      "boat_class": "DOUBLE_SCULL",
      "world_rowing_code": "2x",
      "crew_category": "MEN",
      "athlete_ids": [
        "synthetic-athlete-a",
        "synthetic-athlete-b"
      ],
      "experience": "EXPERIENCED",
      "route_heading_deg": 0.0
    },
    "human_confirmations": {
      "resistance_band_used": null,
      "coach_observed_technique": null,
      "perceived_effort": null
    },
    "input_notice": "All people, dates, route coordinates, telemetry, and weather in this case are synthetic."
  },
  "plan": {
    "schema_version": "wake.training_plan.v1",
    "plan_id": "synthetic-plan-002",
    "scheduled_date": "2026-01-20",
    "timezone": "America/Sao_Paulo",
    "source": {
      "kind": "SYNTHETIC",
      "provenance": "DERIVED_SYNTHETIC",
      "source_ref": "anonymized pattern derived from an approved coach plan"
    },
    "modality": "WATER",
    "athlete_scope": {
      "kind": "CREW",
      "ids": [
        "synthetic-athlete-a",
        "synthetic-athlete-b"
      ]
    },
    "goal_id": "synthetic-goal-regatta-01",
    "coach_language": "6 x 1 km; first 3 at 20 SPM with resistance band, last 3 at 23 SPM; 3-5 minutes active recovery.",
    "blocks": [
      {
        "block_id": "work-band",
        "kind": "WORK",
        "repetitions": 3,
        "distance_m": 1000,
        "duration_s": null,
        "stroke_rate": {
          "min_spm": 19,
          "max_spm": 21
        },
        "zone": "B2/B3",
        "zone_system": "STANDARD_ROWING_ZONES",
        "recovery": {
          "min_s": 180,
          "max_s": 300,
          "mode": "ACTIVE_LIGHT_ROWING"
        },
        "equipment": [
          "RESISTANCE_BAND"
        ],
        "instructions": [
          "Keep the work interval continuous."
        ]
      },
      {
        "block_id": "work-free",
        "kind": "WORK",
        "repetitions": 3,
        "distance_m": 1000,
        "duration_s": null,
        "stroke_rate": {
          "min_spm": 22,
          "max_spm": 24
        },
        "zone": "B2/B3",
        "zone_system": "STANDARD_ROWING_ZONES",
        "recovery": {
          "min_s": 180,
          "max_s": 300,
          "mode": "ACTIVE_LIGHT_ROWING"
        },
        "equipment": [],
        "instructions": [
          "Remove the resistance band before this block."
        ]
      }
    ],
    "unresolved_terms": [],
    "notes": "Synthetic evaluation plan inspired by the structure of a real rowing prescription; it is not a record of an athlete's workout."
  },
  "sources": [
    {
      "source_id": "speedcoach-synthetic",
      "kind": "SPEEDCOACH",
      "evidence_refs": [
        "input/speedcoach.csv"
      ],
      "metrics": {
        "start_time": "2026-01-20T06:00:00.000-03:00",
        "duration_s": 3044.648,
        "end_distance_m": 8041.345,
        "average_positive_spm": 19.03,
        "positive_spm_rows": 613,
        "route_points": 614,
        "rejected_rows": 0,
        "input_format": "WAKE_NORMALIZED_TELEMETRY_CSV",
        "normalized_sha256": "5f76d0af4da638538afbc2849b980c50babcc5de4507683a413cb7d1e0e278b4"
      },
      "quality_flags": [
        "GPS_PRESENT",
        "SPM_PRESENT"
      ],
      "time_series_windows": [
        {
          "start_offset_s": 0,
          "end_offset_s": 30,
          "distance_start_m": 0.0,
          "distance_end_m": 83.3,
          "average_speed_m_s": 2.776,
          "average_spm": 20.33,
          "samples": 6
        },
        {
          "start_offset_s": 30,
          "end_offset_s": 60,
          "distance_start_m": 100.1,
          "distance_end_m": 183.9,
          "average_speed_m_s": 3.355,
          "average_spm": 19.81,
          "samples": 6
        },
        {
          "start_offset_s": 60,
          "end_offset_s": 90,
          "distance_start_m": 200.6,
          "distance_end_m": 283.0,
          "average_speed_m_s": 3.304,
          "average_spm": 20.07,
          "samples": 6
        },
        {
          "start_offset_s": 90,
          "end_offset_s": 120,
          "distance_start_m": 299.5,
          "distance_end_m": 382.2,
          "average_speed_m_s": 3.304,
          "average_spm": 19.97,
          "samples": 6
        },
        {
          "start_offset_s": 120,
          "end_offset_s": 150,
          "distance_start_m": 398.9,
          "distance_end_m": 482.5,
          "average_speed_m_s": 3.344,
          "average_spm": 19.85,
          "samples": 6
        },
        {
          "start_offset_s": 150,
          "end_offset_s": 180,
          "distance_start_m": 499.2,
          "distance_end_m": 582.2,
          "average_speed_m_s": 3.324,
          "average_spm": 20.2,
          "samples": 6
        },
        {
          "start_offset_s": 180,
          "end_offset_s": 210,
          "distance_start_m": 598.6,
          "distance_end_m": 680.9,
          "average_speed_m_s": 3.289,
          "average_spm": 19.72,
          "samples": 6
        },
        {
          "start_offset_s": 210,
          "end_offset_s": 240,
          "distance_start_m": 697.4,
          "distance_end_m": 780.6,
          "average_speed_m_s": 3.324,
          "average_spm": 20.25,
          "samples": 6
        },
        {
          "start_offset_s": 240,
          "end_offset_s": 270,
          "distance_start_m": 797.4,
          "distance_end_m": 881.1,
          "average_speed_m_s": 3.349,
          "average_spm": 19.79,
          "samples": 6
        },
        {
          "start_offset_s": 270,
          "end_offset_s": 300,
          "distance_start_m": 897.6,
          "distance_end_m": 980.0,
          "average_speed_m_s": 3.299,
          "average_spm": 20.14,
          "samples": 6
        },
        {
          "start_offset_s": 300,
          "end_offset_s": 330,
          "distance_start_m": 996.4,
          "distance_end_m": 1043.7,
          "average_speed_m_s": 2.184,
          "average_spm": 17.07,
          "samples": 7
        },
        {
          "start_offset_s": 330,
          "end_offset_s": 360,
          "distance_start_m": 1052.4,
          "distance_end_m": 1095.9,
          "average_speed_m_s": 1.741,
          "average_spm": 16.23,
          "samples": 6
        },
        {
          "start_offset_s": 360,
          "end_offset_s": 390,
          "distance_start_m": 1104.5,
          "distance_end_m": 1146.6,
          "average_speed_m_s": 1.69,
          "average_spm": 15.91,
          "samples": 6
        },
        {
          "start_offset_s": 390,
          "end_offset_s": 420,
          "distance_start_m": 1155.0,
          "distance_end_m": 1196.5,
          "average_speed_m_s": 1.662,
          "average_spm": 15.94,
          "samples": 6
        },
        {
          "start_offset_s": 420,
          "end_offset_s": 450,
          "distance_start_m": 1204.9,
          "distance_end_m": 1247.4,
          "average_speed_m_s": 1.695,
          "average_spm": 16.2,
          "samples": 6
        },
        {
          "start_offset_s": 450,
          "end_offset_s": 480,
          "distance_start_m": 1255.9,
          "distance_end_m": 1299.4,
          "average_speed_m_s": 1.736,
          "average_spm": 15.81,
          "samples": 6
        },
        {
          "start_offset_s": 480,
          "end_offset_s": 510,
          "distance_start_m": 1308.3,
          "distance_end_m": 1351.7,
          "average_speed_m_s": 1.742,
          "average_spm": 16.09,
          "samples": 6
        },
        {
          "start_offset_s": 510,
          "end_offset_s": 540,
          "distance_start_m": 1360.3,
          "distance_end_m": 1401.7,
          "average_speed_m_s": 1.668,
          "average_spm": 16.1,
          "samples": 6
        },
        {
          "start_offset_s": 540,
          "end_offset_s": 570,
          "distance_start_m": 1410.1,
          "distance_end_m": 1493.6,
          "average_speed_m_s": 3.063,
          "average_spm": 19.33,
          "samples": 6
        },
        {
          "start_offset_s": 570,
          "end_offset_s": 600,
          "distance_start_m": 1510.4,
          "distance_end_m": 1593.9,
          "average_speed_m_s": 3.34,
          "average_spm": 20.09,
          "samples": 6
        },
        {
          "start_offset_s": 600,
          "end_offset_s": 630,
          "distance_start_m": 1610.5,
          "distance_end_m": 1692.5,
          "average_speed_m_s": 3.289,
          "average_spm": 19.86,
          "samples": 6
        },
        {
          "start_offset_s": 630,
          "end_offset_s": 660,
          "distance_start_m": 1709.1,
          "distance_end_m": 1792.0,
          "average_speed_m_s": 3.317,
          "average_spm": 20.27,